{
  "transcript": "Yeah. As as much as, it's worth celebrating, the first, spacewalk, with an all female team, I think many of us are looking forward to it just being normal. And, I think if it signifies anything, It is, to honor the the women who came before us who, were skilled and qualified, and didn't get the the same opportunities that we have today.",
  "words": [
    {
      "text": "Yeah",
      "start": 0.08,
      "end": 0.32,
      "speaker": "A"
    },
    {
      "text": "As",
      "start": 0.32,
      "end": 0.80,
      "speaker": "A"
    },
    {
      "text": "as",
      "start": 0.80,
      "end": 1.04,
      "speaker": "A"
    },
    {
      "text": "much",
      "start": 1.04,
      "end": 1.28,
      "speaker": "A"
    },
    {
      "text": "as",
      "start": 1.28,
      "end": 1.60,
      "speaker": "A"
    },
    {
      "text": "it's",
      "start": 2.00,
      "end": 2.24,
      "speaker": "A"
    },
    {
      "text": "worth",
      "start": 2.24,
      "end": 2.74,
      "speaker": "A"
    },
    {
      "text": "celebrating",
      "start": 2.80,
      "end": 3.30,
      "speaker": "A"
    },
    {
      "text": "the",
      "start": 4.40,
      "end": 4.64,
      "speaker": "A"
    },
    {
      "text": "first",
      "start": 4.64,
      "end": 5.04,
      "speaker": "A"
    },
    {
      "text": "spacewalk",
      "start": 5.28,
      "end": 5.78,
      "speaker": "A"
    },
    {
      "text": "with",
      "start": 6.32,
      "end": 6.56,
      "speaker": "A"
    },
    {
      "text": "an",
      "start": 6.56,
      "end": 6.72,
      "speaker": "A"
    },
    {
      "text": "all",
      "start": 6.72,
      "end": 6.96,
      "speaker": "A"
    },
    {
      "text": "female",
      "start": 6.96,
      "end": 7.36,
      "speaker": "A"
    },
    {
      "text": "team",
      "start": 7.36,
      "end": 7.86,
      "speaker": "A"
    }
  ],
  "duration": 25.93,
  "metadata": {
    "model": "nova-2",
    "language": "en-US",
    "channels": 1,
    "processing_time": 1.23
  }
}